{
  "type": "analysis-long-form-conclusion",
  "version": "1.0.0",
  "renderer": "REACT",
  "displayName": "长文本结论卡",
  "category": "CONTENT",
  "minSize": {
    "w": 12,
    "h": 7
  },
  "recommendedSize": {
    "w": 24,
    "h": 10
  },
  "dataContract": {
    "dimensions": {
      "min": 1,
      "max": 3
    },
    "measures": {
      "min": 1,
      "max": 8
    },
    "timeField": {
      "required": false
    },
    "roles": [
      "LABEL",
      "DETAIL",
      "VALUE",
      "TOOLTIP"
    ]
  },
  "stackingRequiresAdditive": false,
  "optionSchema": {
    "type": "object",
    "additionalProperties": false,
    "required": [
      "cardVariant"
    ],
    "properties": {
      "title": {
        "type": "string"
      },
      "subtitle": {
        "type": "string"
      },
      "richText": {
        "type": "string",
        "description": "正文或长文本结论"
      },
      "cardVariant": {
        "type": "string",
        "description": "卡片版式",
        "enum": [
          "01",
          "02",
          "03"
        ]
      },
      "showLegend": {
        "type": "boolean",
        "description": "显示图例"
      },
      "showLabel": {
        "type": "boolean",
        "description": "显示数值标签"
      },
      "numberFormat": {
        "type": "string",
        "description": "数字格式"
      },
      "topN": {
        "type": "integer",
        "description": "最多显示对象数",
        "minimum": 1,
        "maximum": 100
      }
    }
  },
  "defaultOptions": {
    "cardVariant": "01",
    "showLegend": true,
    "showLabel": true,
    "topN": 10,
    "richText": "填写综合结论正文；指标名称和数值将由下方数据绑定自动替换。"
  },
  "mobilePolicy": {
    "supported": true,
    "defaultLegendMode": "HIDDEN",
    "labelDegradation": "ELLIPSIS"
  },
  "supportedInteractions": []
}
